{
  "version": 1,
  "idempotencyKey": "request-contact.send",
  "contextId": "context-1",
  "operation": "contact.send",
  "arguments": {
    "space": {
      "version": 1,
      "id": "space-1",
      "scope": {
        "projectId": "project-1",
        "provider": "imessage",
        "accountId": "account-1",
        "lineId": "line-1",
        "spaceId": "space-1"
      },
      "kind": "space"
    },
    "contact": {
      "name": "Ada",
      "phones": [
        "+15555550100"
      ],
      "emails": []
    }
  }
}
